<?xml version="1.0" encoding="UTF-8"?>
<!DOCTYPE book SYSTEM "book.dtd">

<book id="060">
	<s1 page="0000e-0000f" title="ಎರಡುನುಡಿ" author=""></s1>
	<s1 page="0000g-0000h" title="ಮುನ್ನುಡಿ" author=""></s1>
	<s1 page="0000m-0000m" title="೧. ಅಂದು ಇಂದು" author="ಅಂಬಿಕಾತನಯದತ್ತ"></s1>
	<s1 page="0000n-0000o" title="೨. ಗಾನ" author="ಗೋಪಾಲಕೃಷ್ಣ"></s1>
	<s1 page="0001-0002" title="೩. ಹಕ್ಕಿ ಹಾರುತಿದೆ" author="ಅಂಬಿಕಾತನಯದತ್ತ"></s1>
	<s1 page="0003-0003" title="೪  ಮಯಾಸುರ" author="ರಾಮಚಂದ್ರ"></s1>
	<s1 page="0004-0005" title="೫. ಸಲಿಗೆಯ ಸಲ್ಲಾಪ" author="ಮಧುರ-ಚೆನ್ನ"></s1>
	<s1 page="0006-0006" title="೬. ಮಿಂಚು" author="ಧೂಲಾಸಾಹೇಬ"></s1>
	<s1 page="0007-0010" title="೭. ತುತ್ತಿನ ಚೀಲ" author="ಅಂಬಿಕಾತನಯದತ್ತ"></s1>
	<s1 page="0011-0014" title="೮. ಮೂವತ್ತು ಮೂರು ಕೈ" author="ಅಂಬಿಕಾತನಯದತ್ತ"></s1>
	<s1 page="0015-0016" title="೯. ಕನಸಿನೊಳಗೆ ಕಣಸು" author="ಅಂಬಿಕಾತನಯದತ್ತ"></s1>
	<s1 page="0017-0017" title="೧೦.ಬಿರುಗಾಳಿ " author="ಸಾಲಿರಾಮಚಂದ್ರರಾಯರು"></s1>
	<s1 page="0018-0017" title="೧೧. ಚೆನ್ನ" author="ಜಯಾಶ್ರಯಿ"></s1>
	<s1 page="0019-0020" title="೧೨. ನನ್ನ ಕನ್ನಡ ನಾಡು" author="ಶ್ರೀಧರ"></s1>
	<s1 page="0021-0022" title="೧೩. ಹುಟ್ಟಿದ ಹಬ್ಬ" author="ಸಂಗಮ-ನಾರಾಯಣ"></s1>
	<s1 page="0023-0031" title="೧೪. ನನ್ನ ಶಾಮ" author="ವನಮಾಲಿ"></s1>
	<s1 page="0032-0032" title="೧೫. ಹಂಬಲ" author="ಗಂಗಾಪ್ರಸಾದ"></s1>
	<s1 page="0033-0034" title="೧೬. ಮುದ್ದಿನ ಬಾಲೆ" author="ವಿನಾಯಕ"></s1>
	<s1 page="0035-0035" title="೧೭. ಆಟ" author="ನಾರಾಯಣಶಾಸ್ತ್ರಿ"></s1>
	<s1 page="0036-0040" title="೧೮. ಚೆಲುವಿನ ಬೇಟೆ" author="ಆನಂದಕಂದ"></s1>
	<s1 page="0041-0042" title="೧೯. ಲಲ್ಲೆಯ ನೆನಹು" author="ಶಿವರಾಮ"></s1>
	<s1 page="0043-0043" title="೨೦. `ಏನಾರೆ'" author="ಬಿಂದು ಮಾಧವ"></s1>
	<s1 page="0044-0045" title="೨೧. ಅಯೋಧ್ಯೆ" author="ವಿನಾಯಕ"></s1>
	<s1 page="0046-0047" title="೨೨. ಅಗಲಿದ ಗೆಳೆಯ" author="ಶೇಷ"></s1>
	<s1 page="0048-0048" title="೨೩. ಬೀಸು ತಾಯಿ !" author="ರಂಗನಾಥ"></s1>
	<s1 page="0049-0050" title="೨೪. ಕಂಬನಿ" author="ರಾಮದಾಸ"></s1>
	<s1 page="0051-0052" title="೨೫. ಹೇವವಿರಲಿ" author="ಬಿಂದುಮಾಧವ"></s1>
	<s1 page="0053-0054" title="೨೬. ಶ್ರುತಾಶ್ರುತ ವೀ" author="ಮಧುರ-ಚೆನ್ನ"></s1>
	<s1 page="0055-0056" title="೨೭.ಇಂಚರಂ " author="ಸಾಲಿ ರಾಮಚಂದ್ರರಾಯರು"></s1>
	<s1 page="0057-0058" title="೨೮. ಚೆಲುವು-ಒಲವು" author="ಆನಂದಕಂದ"></s1>
	<s1 page="0059-0061" title="೨೯. ಒರ್ವ ದೇವಿ" author="ರಾಮಚಂದ್ರ"></s1>
	<s1 page="0062-0063" title="೩೦. ನಸುಕು" author="ಪ್ರಲ್ಹಾದ"></s1>
	<s1 page="0064-0064" title="೩೧. ಕೃಷ್ಣೆಗೆ" author="ಚಿದಂಬರ"></s1>
	<s1 page="0065-0066" title="೩೨. ನೀಲಗಿರಿ " author="ಪ್ರಲ್ಹಾದ"></s1>
	<s1 page="0067-0068" title="೩೩. ಬೇಸಗೆ" author="ಲಿಂಗಪ್ಪ"></s1>
	<s1 page="0069-0069" title="೩೪. ಏನಿರಲಿಲ್ಲ ?" author="ರೇವಣ"></s1>
	<s1 page="0070-0072" title="೩೫. ಹೊಸಕಾಲದ ನವಿಲು" author="ರಂಗನಾಥ"></s1>
	<s1 page="0073-0075" title="೩೬. ಎಳೆಯರಾಗುವಾ ! ನಾವು ಗೆಳೆಯರಾಗುವಾ !" author="ರಾಮದಾಸ"></s1>
	<s1 page="0077-0078" title="೩೭. ಕವಿಗಳೂ ಕವಿತೆಗಳೂ - ವರ್ಣಾನುಕ್ರಮದಿಂದ" author=""></s1>
	<s1 page="0079-0080" title="೩೮. ಕವಿತೆಗಳ ಮೊದಲ ಸಾಲುಗಳ ಪರಿವಿಡಿ - ವರ್ಣಾನುಕ್ರಮದಿಂದ" author=""></s1>
</book>
