<?xml version="1.0" encoding="UTF-8"?>
<!DOCTYPE book SYSTEM "book.dtd">

<book id="002">
	<s1 page="0000ah-0000ai" title="ಮುನ್ನುಡಿ" author="ತಿಪ್ಪೇರುದ್ರಸ್ವಾಮಿ ಎಚ್."></s1>
	<s1 page="0000aj-0000al" title="ವಿಭಾಗ ಸಂಪಾದಕರ ಮಾತು" author="ಪಾರ್ವತಮ್ಮ ಸಿ."></s1>
	<s1 page="0000am-0000an" title="ಅರಿಕೆ" author="ಮಲ್ಲಿನಾಥಯ್ಯ ಡಿ. ಎಚ್."></s1>
	<s1 page="0000o-0000u" title="ಪೀಠಿಕೆ" author="ವಿಲಿಯಂ ಎಫ್. ಆಗ್ ಬರ್ನ್;ಮೆಯರ್ ಎಫ್. ನಿಮ್ ಕಾಫ್"></s1>
	<s1 page="0000av-0000aw" title="ಮೊದಲ ಇಂಗ್ಲಿಷ್ ಆವೃತ್ತಿಗೆ ಪ್ರಸ್ತಾವನೆ" author="ಕಾರ್ಲ್ ಮನ್ ಹೀಮ್"></s1>
	<s1 page="0000aw-0000aw" title="ಐದನೆಯ ಇಂಗ್ಲಿಷ್ ಆವೃತ್ತಿಗೆ ಪ್ರಸ್ತಾವನೆ" author="ಸ್ಟೆಫನ್ ಕೋಟ್ ಗ್ರೋವ್"></s1>
	<s1 page="0001-0042" title="ಭಾಗ ೧ : ಪೀಠಿಕೆ" author="">
		<s2 page="0001-0026" title="೧. ಸಮಾಜಶಾಸ್ತ್ರ ಮತ್ತು ವಿಜ್ಞಾನ" author=""></s2>
		<s2 page="0027-0042" title="೨. ಮಾನವನ ಸಾಮಾಜಿಕ ಜೀವನಕ್ಕೆ ಸಂಬಂಧಪಟ್ಟ ವಿಷಯಗಳು" author=""></s2>
	</s1>
	<s1 page="0043-0139" title="ಭಾಗ ೨ : ಸಮಾಜ" author="">
		<s2 page="0043-0078" title="೩. ಸಂಸ್ಕೃತಿಯ ಪಾತ್ರ" author=""></s2>
		<s2 page="0079-0119" title="೪. ಜೈವಿಕಾಂಶದ ಕೊಡುಗೆ" author=""></s2>
		<s2 page="0120-0139" title="೫. ಸಮಾಜದಲ್ಲಿ ಭೌಗೋಳಿಕಾಂಶ" author=""></s2>
	</s1>
	<s1 page="0140-0266" title="ಭಾಗ ೩ : ಸಾಮೂಹಿಕ ವರ್ತನೆ" author="">
		<s2 page="0141-0193" title="೬. ಸಮೂಹ ಸಂಯೋಜನೆ" author=""></s2>
		<s2 page="0194-0232" title="೭. ಜನಸ್ತೋಮ ಮತ್ತು ಸಾರ್ವಜನಿಕರು" author=""></s2>
		<s2 page="0233-0266" title="೮. ಸಾಮಾಜಿಕ ನಿಯಂತ್ರಣ ಮತ್ತು ಅನುವರ್ತನೆ" author=""></s2>
	</s1>
	<s1 page="0267-0415" title="ಭಾಗ ೪ : ವ್ಯಕ್ತಿತ್ವ" author="">
		<s2 page="0270-0319" title="೯. ಸಮೂಹ ಮತ್ತು ವ್ಯಕ್ತಿತ್ವ" author=""></s2>
		<s2 page="0320-0358" title="೧೦. ಸಂಸ್ಕೃತಿ ಹಾಗೂ ವ್ಯಕ್ತಿತ್ವ" author=""></s2>
		<s2 page="0359-0415" title="೧೧. ಸಮಾಜೀಕರಣ ಹಾಗೂ ಸಾಮಾಜಿಕ ವಿಚಲನೆ" author=""></s2>
	</s1>
	<s1 page="0416-0544" title="ಭಾಗ ೫ : ಮಾನವಜೀವಿ ಪರಿಸರಶಾಸ್ತ್ರ ಹಾಗೂ ಜನಸಂಖ್ಯೆ" author="">
		<s2 page="0417-0475" title="೧೨. ಸಮುದಾಯಗಳು" author=""></s2>
		<s2 page="0476-0495" title="೧೩. ಜನಸಂಖ್ಯೆಯ ಹಂಚಿಕೆ" author=""></s2>
		<s2 page="0496-0544" title="೧೪. ಜನಸಂಖ್ಯೆಯ ಬೆಳವಣಿಗೆ" author=""></s2>
	</s1>
	<s1 page="0545-0932" title="ಭಾಗ ೬ : ಸಾಮಾಜಿಕ ಸಂಘಟನೆ" author="">
		<s2 page="0547-0579" title="೧೫. ಸಾಮಾಜಿಕ ವ್ಯವಸ್ಥೆ" author=""></s2>
		<s2 page="0580-0645" title="೧೬. ಸಾಮಾಜಿಕ ಸ್ತರವಿನ್ಯಾಸ" author=""></s2>
		<s2 page="0646-0700" title="೧೭. ಸಮಾಜ ಹಾಗೂ ಆರ್ಥಿಕ ಸಂಸ್ಥೆಗಳು" author=""></s2>
		<s2 page="0701-0740" title="೧೮. ಸಮಾಜದ ಆಡಳಿತ ಸಂಸ್ಥೆಗಳು" author=""></s2>
		<s2 page="0741-0790" title="೧೯. ಯುದ್ಧ ಹಾಗೂ ಅಂತರರಾಷ್ಟ್ರೀಯ ಸಂಬಂಧಗಳು" author=""></s2>
		<s2 page="0791-0849" title="೨೦. ಧಾರ್ಮಿಕ ಸಂಸ್ಥೆಗಳು" author=""></s2>
		<s2 page="0850-0902" title="೨೧. ಕುಟುಂಬ" author=""></s2>
		<s2 page="0903-0932" title="೨೨. ಸಂಸ್ಥೆಗಳ ಪರಸ್ಪರ ಸಂಬಂಧ" author=""></s2>
	</s1>
	<s1 page="0933-" title="ಭಾಗ ೭ : ಸಾಮಾಜಿಕ ಸಾಂಸ್ಕೃತಿಕ ಬದಲಾವಣೆ" author=""></s1>
</book>
