<?xml version="1.0" encoding="UTF-8"?>
<!DOCTYPE book SYSTEM "book.dtd">

<book id="066">
	<s1 page="0005-0006" title="Preface" author="Edward P. Rice"></s1>
	<s1 page="0007-0011" title="I. The Kanarese Language and Country" author="Edward P. Rice">
		<s2 page="0007-0007" title="The Dravidian Languages" author=""></s2>
		<s2 page="0007-0008" title="The Kanarese Country" author=""></s2>
		<s2 page="0008-0008" title="The Name of the Language" author=""></s2>
		<s2 page="0008-0009" title="Earliest Specimens" author=""></s2>
		<s2 page="0009-0010" title="The Alphabet and Written Character" author=""></s2>
		<s2 page="0010-0010" title="Historic Changes" author=""></s2>
		<s2 page="0010-0011" title="Influence of Neighbouring Languages" author=""></s2>
	</s1>
	<s1 page="0012-0015" title="II. Periods of the History of Kanarese Literature" author="Edward P. Rice">
		<s2 page="0013-0015" title="Kingdoms and Dynasties of the Kanarese Country" author=""></s2>
	</s1>
	<s1 page="0016-0036" title="III. The Jaina Period to A. D. 1160" author="Edward P. Rice">
		<s2 page="0016-0022" title="The Jaina Religion in the Kanarese Country" author=""></s2>
		<s2 page="0022-0025" title="Writers previous to the Kavirājamārga" author=""></s2>
		<s2 page="0025-0026" title="Stanzas from Kavirājamārga" author=""></s2>
		<s2 page="0026-0033" title="Writers from the Kavirājamārga to the Lingāyat Revival" author=""></s2>
		<s2 page="0033-0036" title="Illustrative Extract from the Pampa Rāmāyaṇa" author=""></s2>
	</s1>
	<s1 page="0037-0041" title="IV. The Rise of Lingayatism (1160)" author="Edward P. Rice">
		<s2 page="0037-0039" title="Basava and the Early Apostles of Lingāyatism" author=""></s2>
		<s2 page="0039-0041" title="Notes on Lingāyatism" author=""></s2>
	</s1>
	<s1 page="0042-0050" title="V. Lingayat Writers from 1160-1600" author="Edward P. Rice">
		<s2 page="0045-0046" title="Stanzas from Somēśvara Śataka" author=""></s2>
		<s2 page="0046-0048" title="The Basava Purāṇa, with Illustrative Extract" author=""></s2>
		<s2 page="0048-0050" title="Later Writers of the Period" author=""></s2>
	</s1>
	<s1 page="0051-0054" title="VI. Jaina Writers of the Lingāyat Period 1160-1600" author="Edward P. Rice"></s1>
	<s1 page="0055-0060" title="The Rise of Vaishnava Literature (1500-1600)" author="Edward P. Rice">
		<s2 page="0055-0057" title="The Vaishṇava Revival" author=""></s2>
		<s2 page="0057-0057" title="Early Vaishṇava Works" author=""></s2>
		<s2 page="0057-0059" title="Translations of Sanskrit Classics" author=""></s2>
		<s2 page="0059-0060" title="Popular Devotional Songs" author=""></s2>
		<s2 page="0060-0060" title="A Song in Praise of Vishṇu" author=""></s2>
	</s1>
	<s1 page="0061-0071" title="VIII. Kanarese Literature in the XVII and XVIII Centuries" author="Edward P. Rice">
		<s2 page="0061-0063" title="Three Eminent Writers" author=""></s2>
		<s2 page="0064-0066" title="Extract from the Jaimini Bhārata" author=""></s2>
		<s2 page="0066-0067" title="Literature at the Court of the Rājas of Mysore" author=""></s2>
		<s2 page="0067-0069" title="Lingāyat, Jaina and Brahmanical Doctrinal Works" author=""></s2>
		<s2 page="0069-0069" title="Verses by Sarvajnya" author=""></s2>
		<s2 page="0069-0071" title="Collections of Short Stories" author=""></s2>
		<s2 page="0071-0071" title="Specimen of Kanarese Humour" author=""></s2>
	</s1>
	<s1 page="0072-0077" title="IX. The Modern Period (XIX Century)" author="Edward P. Rice">
		<s2 page="0072-0074" title="New Classes of Works" author=""></s2>
		<s2 page="0074-0075" title="Mysore Royal Anthem" author=""></s2>
		<s2 page="0075-0077" title="Present Position and Prospects of Kanarese Literature" author=""></s2>
	</s1>
	<s1 page="0078-0081" title="X. Some Characteristics of Kanarese Literature" author="Edward P. Rice"></s1>
	<s1 page="0082-0085" title="XI. Kanarese Grammalans" author="Edward P. Rice"></s1>
	<s1 page="0086-0087" title="XII. Sanskrit Writers in the Kanarese Country" author="Edward P. Rice"></s1>
	<s1 page="0088-0089" title="Leading Dates" author="Edward P. Rice"></s1>
	<s1 page="0090-0090" title="Appendix A. Original Text of Some Stanzas Quoted" author="Edward P. Rice"></s1>
	<s1 page="0091-0092" title="Appendix B. Biblography" author="Edward P. Rice"></s1>
	<s1 page="0093-0101" title="Index" author="Edward P. Rice"></s1>
</book>
