<?xml version="1.0" encoding="UTF-8"?>
<!DOCTYPE book SYSTEM "book.dtd">

<book id="013">
	<s1 page="0001-0008" title="೧. ಪದಮಂತ್ರಗೋಪ್ಯ" author=""></s1>
	<s1 page="0009-0120" title="೨. ನೂರೊಂದರ ಹಾಡುಗಳು" author=""></s1>
	<s1 page="0121-0154" title="೩ ಸಟೀಕ ಏಕೋತ್ತರಶತಸ್ಥಲ" author=""></s1>
	<s1 page="0155-0170" title="೪. ಕವಿ ಗುರುಬಸವಕೃತ ಅವಧೂತಗೀತೆ" author=""></s1>
	<s1 page="0171-0204" title="೫. ಪ್ರಾಣಲಿಂಗ ಜ್ಞಾನದರ್ಪಣ ಚಾರಿತ್ರ" author=""></s1>
	<s1 page="0205-0212" title="೬. ಶಿವಯೋಗಾಚರಣೆ" author=""></s1>
	<s1 page="0213-0266" title="೭. ಶಿವಶರಣರ ಪದಗಳು-೧" author=""></s1>
	<s1 page="0267-0292" title="೮. ಹರಳಯ್ಯನ ತ್ರಿಪದಿ" author=""></s1>
	<s1 page="0293-0370" title="೯. ಮೈಲಾರ ಬಸಪ್ಪನ ಶಿವಾನುಭವ ದರ್ಪಣ" author=""></s1>
	<s1 page="0371-0386" title="೧೦. ಹಾನಗಲ್ಲ ಸ್ವಾಮಿಗಳವರು ರಚಿಸಿದ ಹಾಡುಗಬ್ಬಗಳು" author=""></s1>
	<s1 page="0387-0458" title="೧೧. ಬಸವೇಶ್ವರನ ಷಟ್ ಸ್ಥಲ ವಚನದ ಕಥಾಸಾರ" author=""></s1>
	<s1 page="0459-0496" title="೧೨. ನಿರಂಜನ ವಂಶ ರತ್ನಾಕರ" author=""></s1>
	<s1 page="0497-0508" title="೧೩. ಭೈರವೇಶ್ವರಕಾವ್ಯದ ಕಥಾಮಣಿಸೂತ್ರ ರತ್ನಾಕರ" author=""></s1>
	<s1 page="0509-0532" title="೧೪. ವರದಾನಿ ಗುಡ್ದವ್ವೆಯ ಚರಿತ್ರೆ" author=""></s1>
	<s1 page="0533-0788" title="೧೫. ನಾಗಭೂಷಣ ಘನಾಮಠದಾರ್ಯರ ಕೃಷಿಜ್ಞಾನಪ್ರದೀಪಿಕೆ" author=""></s1>
	<s1 page="0789-0846" title="೧೬. ಕೊಡಗಿನ ಸಂಸ್ಥಾನದ ರಾಜೇಂದ್ರನಾಮೆ" author=""></s1>
	<s1 page="0847-0862" title="೧೭. ಕೆಳದಿ ಸಂಸ್ಥಾನದ ರಾಯರ ವಂಶಾವಳಿ" author=""></s1>
</book>
