<?xml version="1.0" encoding="UTF-8"?>
<!DOCTYPE book SYSTEM "book.dtd">

<book id="019">
	<s1 page="0001-0134" title="೧. ಲೇಖನಗಳು" author=""></s1>
	<s1 page="0135-0198" title="೨. ಸಂಪಾದನೆ" author=""></s1>
	<s1 page="0199-0204" title="೩. ಸ್ಫುಟವಿಷಯಗಳು" author=""></s1>
	<s1 page="0205-0216" title="೪. ಗ್ರಂಥಪರಿಚಯ / ವಿಮರ್ಶೆ" author=""></s1>
	<s1 page="0217-0244" title="೫. ಶಿವಾನುಭವ : ಸಹಾಯಧನ/ದೇಣಿಗೆ/ಕಾಣಿಕೆಗಳು" author=""></s1>
	<s1 page="0245-0262" title="೬. ಶಿವಾನುಭವ ಪತ್ರಿಕೆ : ಸೂಚನೆ/ವಿನಂತಿ" author=""></s1>
	<s1 page="0263-0272" title="೭. ಶ್ರದ್ಧಾಂಜಲಿ" author=""></s1>	
	<s1 page="0273-0294" title="೮. ಜಾಹೀರಾತು" author=""></s1>
	<s1 page="0295-0310" title="೯. ಇತರ" author=""></s1>
	<s1 page="0311-0437" title="೧೦. ಶಿವಾನುಭವ ಸಂಚಿಕೆಗಳು ಮತ್ತು ಪರಿವಿಡಿಗಳು" author=""></s1>
</book>

