<?xml version="1.0" encoding="UTF-8"?>
<!DOCTYPE book SYSTEM "book.dtd">

<book id="065">
	<s1 page="0000g-0000j" title="ಪ್ರಸ್ತಾವನೆ" author="ವೇ. ತಿ. ಗಳಗನಾಥರು"></s1>
	<s1 page="0001-0011" title="೧ನೆಯ ಪ್ರಕರಣ : ಮಾರುತಿಯ ದೇವಾಲಯ" author="ವೇ. ತಿ. ಗಳಗನಾಥರು"></s1>
	<s1 page="0011-0021" title="೨ನೆಯ ಪ್ರಕರಣ : ಗುಪ್ತಗುಹೆ" author="ವೇ. ತಿ. ಗಳಗನಾಥರು"></s1>
	<s1 page="0021-0034" title="೩ನೆಯ ಪ್ರಕರಣ : ಸಾಕ್ಷಾತ್ಕಾರ" author="ವೇ. ತಿ. ಗಳಗನಾಥರು"></s1>
	<s1 page="0034-0046" title="೪ನೆಯ ಪ್ರಕರಣ : ಸಂಕಟಪ್ರಾಪ್ತಿ" author="ವೇ. ತಿ. ಗಳಗನಾಥರು"></s1>
	<s1 page="0047-0059" title="೫ನೆಯ ಪ್ರಕರಣ : ಕಾರಾಗೃಹವಾಸ" author="ವೇ. ತಿ. ಗಳಗನಾಥರು"></s1>
	<s1 page="0060-0073" title="೬ನೆಯ ಪ್ರಕರಣ : ಆಲೋಚನೆ" author="ವೇ. ತಿ. ಗಳಗನಾಥರು"></s1>
	<s1 page="0074-0088" title="೭ನೆಯ ಪ್ರಕರಣ : ಬಂಧವಿಮೋಚನ" author="ವೇ. ತಿ. ಗಳಗನಾಥರು"></s1>
	<s1 page="0089-0103" title="೮ನೆಯ ಪ್ರಕರಣ : ಜುಲುಮೆಯ ರಾಮ ರಾಮ" author="ವೇ. ತಿ. ಗಳಗನಾಥರು"></s1>
	<s1 page="0103-0114" title="೯ನೆಯ ಪ್ರಕರಣ : ಪ್ರತಿಜ್ಞೆ" author="ವೇ. ತಿ. ಗಳಗನಾಥರು"></s1>
	<s1 page="0115-0121" title="೧೦ನೆಯ ಪ್ರಕರಣ : ದುರಾಲೋಚನೆ" author="ವೇ. ತಿ. ಗಳಗನಾಥರು"></s1>
	<s1 page="0122-0131" title="೧೧ನೆಯ ಪ್ರಕರಣ : ವಿಚಿತ್ರಯೋಗ" author="ವೇ. ತಿ. ಗಳಗನಾಥರು"></s1>
	<s1 page="0131-0142" title="೧೨ನೆಯ ಪ್ರಕರಣ : ಹೊಸ ಚಿಂತೆ" author="ವೇ. ತಿ. ಗಳಗನಾಥರು"></s1>
	<s1 page="0142-0151" title="೧೩ನೆಯ ಪ್ರಕರಣ : ದೈವಸಂಕಲ್ಪ" author="ವೇ. ತಿ. ಗಳಗನಾಥರು"></s1>
	<s1 page="0152-0162" title="೧೪ನೆಯ ಪ್ರಕರಣ : ಹೆಣ್ಣಿನ ಹೇಸಿ ಆಶೆ" author="ವೇ. ತಿ. ಗಳಗನಾಥರು"></s1>
	<s1 page="0163-0174" title="೧೫ನೆಯ ಪ್ರಕರಣ : ಸೌಜನ್ಯ ಪ್ರಭಾವ" author="ವೇ. ತಿ. ಗಳಗನಾಥರು"></s1>
	<s1 page="0175-0186" title="೧೬ನೆಯ ಪ್ರಕರಣ : ಸಮರ್ಥರ ದರ್ಶನ" author="ವೇ. ತಿ. ಗಳಗನಾಥರು"></s1>
	<s1 page="0186-0196" title="೧೭ನೆಯ ಪ್ರಕರಣ : ಒಳಸಂಚು" author="ವೇ. ತಿ. ಗಳಗನಾಥರು"></s1>
	<s1 page="0197-0209" title="೧೮ನೆಯ ಪ್ರಕರಣ : ಇದೇನು ಗದ್ದಲವು ?" author="ವೇ. ತಿ. ಗಳಗನಾಥರು"></s1>
	<s1 page="0209-0222" title="೧೯ನೆಯ ಪ್ರಕರಣ : ದುರ್ಗಪ್ರಾಪ್ತಿ" author="ವೇ. ತಿ. ಗಳಗನಾಥರು"></s1>
	<s1 page="0222-0231" title="೨೦ನೆಯ ಪ್ರಕರಣ : ಸೌಶೀಲ್ಯ" author="ವೇ. ತಿ. ಗಳಗನಾಥರು"></s1>
	<s1 page="0231-0239" title="೨೧ನೆಯ ಪ್ರಕರಣ : ಸತ್ಸಮಾಗಮ ಪ್ರಭಾವ" author="ವೇ. ತಿ. ಗಳಗನಾಥರು"></s1>
</book>
