<?xml version="1.0" encoding="UTF-8"?>
<!DOCTYPE book SYSTEM "book.dtd">
<book id="022" sstitle="ಹಳತು ಹೊನ್ನು">
	<s1 page="0001-0152" title="ವಿದ್ಯಾರ್ಥಿ ಕಾಂಡ" author="">
		<s2 page="0001-0013" title="ಕ್ಷೇಮಸಮಾಚಾರದ ಕಾಗದಗಳು, ಲೇಖನ ಚಿಹ್ನಗಳು, ಒಕ್ಕಣೆ-ಮರಿಯಾದೆ, ಸ್ಥಳ - ಕಾಲ - ವಿಳಾಸ, ಮರಿಯಾದೆಯ ಮಾತುಗಳು, ಬರೆದು ಮುಗಿಸುವಿಕೆ, ವಿಳಾಸ ಬರೆಯುವುದು, ಹೆಚ್ಚು ಮರಿಯಾದೆಯ ಒಕ್ಕಣೆಗಳು" author=""></s2>
		<s2 page="0014-0024" title="ಶ್ರೀ ಶೃಂಗೇರಿ ಮಠಕ್ಕೆ, ಕುಂಭಕೋಣ ಮಠಕ್ಕೆ, ಪುಷ್ಪಗಿರಿ ಮಠಕ್ಕೆ, ವಿರೂಪಾಕ್ಷ, ಕೂಡಲಿ, ಶಿವಗಣ್ಗೆ, ಅವನಿ ಮಠಗಳಿಗೆ, ಶ್ರೀ ಪರಕಾಲ ಮಠಕ್ಕೆ, ಶ್ರೀ ಉತ್ತರಾದಿ ಮಠ, ಶ್ರೀ ವ್ಯಾಸರಾಯ ಮಠ, ಶ್ರೀ ಮದ ಹೋಬಲ ಮಠ, ಶ್ರೀ ರಾಘವೇಂದ್ರಸ್ವಾಮಿ ಮಠ, ವೈಶ್ಯ ಗುರುಗಳಿಗೆ, ಶ್ರೀ ಮುರುಘೇಂದ್ರ ಸ್ವಾಮಿಗಳವರಿಗೆ, ಪಖೀರಸ್ವಾಮಿಗಳವರಿಗೆ, ಶೈವವಿರಕ್ತ ಸಾಮಾನ್ಯರಿಗೆ, ಜೈನ ಮಠಾಧಿಪತಿಗಳಿಗೆ, ಜೈನಬ್ರಾಹ್ಮಣರು ಪರಸ್ಪರ ಬರೆಯುವಿಕೆ, ಜೈನಬ್ರಾಹ್ಮಣೇತರರಿಗೆ, ವಿಶ್ವಕರ್ಮಗುರುಗಳಿಗೆ, ವಿಶ್ವಕರ್ಮ ಸಾಮಾನ್ಯರಿಗೆ, ವೀರಶೈವ ಸಾಮಾನ್ಯರು ಪರಸ್ಪರ ಬರೆಯುವಿಕೆ, ನಗರಸ್ಥ ಲಿಂಗಾಯಿತ ವೈಶ್ಯ ಸಾಮಾನ್ಯರು ಬರೆಯುವಿಕೆ " author=""></s2>
		<s2 page="0024-0044" title="ಹೆಂಡತಿಯು ಗಂಡನಿಗೆ, ಗಂಡನು ಹೆಂಡತಿಗೆ, ನಾಯಕನಿಗೆ ನಾಯಿಕೆಯು, ನಾಯಿಕೆಯು ನಾಯಯಕನಿಗೆ , ಲಗ್ನಪತ್ರಿಕೆ, ಅವುಗಳ ಮುಖ್ಯಾಂಶಗಳು, ಮಗು ಹುಟ್ಟಿದ ಸಮಾಚಾರ, ಊಟಕ್ಕೆ ಕರೆಯುವುದು, ದೇಹಾಲಾಸ್ಯವನ್ನು ಕುರಿತು, ವಿದ್ಯಾರ್ಥಿಯು ತಂದೆಗೆ ಬರೆಯುವಿಕೆ, ಸಾವಿನ ಸುದ್ದಿಯನ್ನು ತಿಳಿಸುವಿಕೆ, ದುಃಖೋಪಶಮನವಾರ್ತೆ, ಅದಕ್ಕೆ  ಪ್ರತ್ಯುತ್ತರ, ಸಾಲವನ್ನು ಕೇಳುವುದು, ಅದನ್ನು ಕೊಡಲು ವೊಪ್ಪಿಕೆ, ಅದಿಲ್ಲವೆಂದು ಹೇಳುವಿಕೆ, ಸಾಲಕ್ಕೆ ತಗಾದೆ, ಅದಕ್ಕೆ ಪ್ರತ್ಯುತ್ತರ, ಮತ್ತೊಂದು ಬಗೆ, ಇನ್ನೊಂದು ಬಗೆ, ಗುಮಾಸ್ತೆ ಬೇಕೆಂದು, ಗುಮಾಸ್ತೆಯ ಹೊಗಳಿಕೆ, ಗುಮಾಸ್ತೆಯ ತಿರಸ್ಕಾರ, ವರ್ತಕರ ಸಾಲದ ಹೊಣೆಗೆ, ಸರಕುಗಳಲ್ಲಿ ಗುಣದೋಷಗಳು, ಅದಕ್ಕೆ ಪ್ರತ್ಯುತ್ತರ, ಭಾಗಸ್ತರ ಸಂಗತಿ, ಸೇರಿಸಿಕೊಂಡದ್ದು, ತಪ್ಪಿಸಿದ್ದು, ಗಂಡನಿಗೆ ಹೆಂಡತಿ ಬರೆಯುವುದು, ಹೆಂಡತಿಗೆ ಗಂಡ ಬರೆಯುವುದು, ಪುಸ್ತಕಗಳು ಬೇಕೆಂದು ಎ ಪಿ ದ್ವಾರ, ಆಕ್ಷೇಪಣೆಗಳು, ಮುದ್ರಾಯಂತ್ರಗಳವರಿಗೆ. " author=""></s2>
		<s2 page="0045-0051" title="" author=""></s2>
	</s1>
	<s1 page="0053-0463" title="ಶಾಸನ ಕಾಂಡ" author="">
	</s1>
	<s1 page="0464-0540" title="ವ್ಯವಹಾರ ಕಾಂಡ" author="">
	</s1>
	<s1 page="0541-0578" title="ಜ್ಞಾನ ಕಾಂಡ" author="">
	</s1>
</book>
