<?xml version="1.0" encoding="UTF-8"?>
<!DOCTYPE book SYSTEM "book.dtd">

<book id="058">
	<s1 page="0000d-0000d" title="ಉಪೋದ್ಘಾತ" author="ದಿವಾನ್ ಬಹದ್ದೂರ್ ಕೆ. ರಂಗಾಚಾರ್ಯ"></s1>
	<s1 page="0001-0007" title="1. ಸಸ್ಯಗಳೂ ಜೀವವುಳ್ಳವು" author="ದಿವಾನ್ ಬಹದ್ದೂರ್ ಕೆ. ರಂಗಾಚಾರ್ಯ"></s1>
	<s1 page="0007-0017" title="2. ಗಿಡಗಳೂ, ಅವುಗಳ ಅವಯವಗಳೂ" author="ದಿವಾನ್ ಬಹದ್ದೂರ್ ಕೆ. ರಂಗಾಚಾರ್ಯ"></s1>
	<s1 page="0017-0027" title="3. ಬೀಜ, ಬೀಜಗಳ ಮೊಳೆಯುವಿಕೆ ಮತ್ತು ಮೊಳೆಗಳು" author="ದಿವಾನ್ ಬಹದ್ದೂರ್ ಕೆ. ರಂಗಾಚಾರ್ಯ"></s1>
	<s1 page="0028-0035" title="4. ಬೇರು" author="ದಿವಾನ್ ಬಹದ್ದೂರ್ ಕೆ. ರಂಗಾಚಾರ್ಯ"></s1>
	<s1 page="0035-0052" title="5. ಪ್ರಕಾಂಡವೂ ಕೊಂಬೆಗಳೂ" author="ದಿವಾನ್ ಬಹದ್ದೂರ್ ಕೆ. ರಂಗಾಚಾರ್ಯ"></s1>
	<s1 page="0052-0062" title="6. ಎಲೆ" author="ದಿವಾನ್ ಬಹದ್ದೂರ್ ಕೆ. ರಂಗಾಚಾರ್ಯ"></s1>
	<s1 page="0063-0071" title="7. ಪುಷ್ಪಮಂಜರಿ" author="ದಿವಾನ್ ಬಹದ್ದೂರ್ ಕೆ. ರಂಗಾಚಾರ್ಯ"></s1>
	<s1 page="0071-0085" title="8. ಹೂವೂ, ಅದರ ಭಾಗಗಳೂ" author="ದಿವಾನ್ ಬಹದ್ದೂರ್ ಕೆ. ರಂಗಾಚಾರ್ಯ"></s1>
	<s1 page="0086-0096" title="9. ಪುಷ್ಪರೇಣುಸ್ಪರ್ಶವೂ, ಗರ್ಭಧಾರಣವೂ" author="ದಿವಾನ್ ಬಹದ್ದೂರ್ ಕೆ. ರಂಗಾಚಾರ್ಯ"></s1>
	<s1 page="0096-0109" title="10. ಕಾಯಿಯೂ, ಬೀಜವೂ" author="ದಿವಾನ್ ಬಹದ್ದೂರ್ ಕೆ. ರಂಗಾಚಾರ್ಯ"></s1>
	<s1 page="0109-0118" title="11. ನೀರು ಒಳಹೊಗುವುದೂ, ಅದರ ಚಲನೆಯೂ" author="ದಿವಾನ್ ಬಹದ್ದೂರ್ ಕೆ. ರಂಗಾಚಾರ್ಯ"></s1>
	<s1 page="0118-0133" title="12. ಗಿಡಗಳ ಪೋಷಣೆ" author="ದಿವಾನ್ ಬಹದ್ದೂರ್ ಕೆ. ರಂಗಾಚಾರ್ಯ"></s1>
	<s1 page="0133-0140" title="13. ಗಿಡಗಳ ಬೆಳೆವಳಿಕೆ, ಉಸಿರಾಡುವುದು, ಮತ್ತು ಅವುಗಳ ಭಾಗಗಳ ಚಲನೆ" author="ದಿವಾನ್ ಬಹದ್ದೂರ್ ಕೆ. ರಂಗಾಚಾರ್ಯ"></s1>
	<s1 page="0140-0147" title="14. ಗಿಡಗಳ ಜಾತಿಗಳು" author="ದಿವಾನ್ ಬಹದ್ದೂರ್ ಕೆ. ರಂಗಾಚಾರ್ಯ"></s1>
</book>
