<?xml version="1.0" encoding="UTF-8"?>
<!DOCTYPE book SYSTEM "book.dtd">

<book id="052">
	<s1 page="0001-0002" title="ಶ್ರೀಗಣೇಶದ್ವಾದಶನಾಮಾವಳಿಯ ಉಪೋದ್ಘಾತ" author=""></s1>
	<s1 page="0003-0003" title="ಶ್ರೀಗಣೇಶದ್ವಾದಶನಾಮಾವಳಿ" author=""></s1>
	<s1 page="0004-0004" title="ಶ್ರೀಗಣೇಶೈಕವಿಂಶತಿನಾಮಾವಳಿಯ ಉಪೋದ್ಘಾತ" author=""></s1>
	<s1 page="0005-0005" title="ಶ್ರೀಗಣೇಶೈಕವಿಂಶತಿನಾಮಾವಳಿ" author=""></s1>
	<s1 page="0006-0008" title="ಶ್ರೀಗಣೇಶಾಷ್ಟೋತ್ತರಶತನಾಮಾವಳಿಯ ಉಪೋದ್ಘಾತ" author=""></s1>
	<s1 page="0009-0011" title="ಶ್ರೀಗಣೇಶಾಷ್ಟೋತ್ತರಶತನಾಮಾವಳಿ" author=""></s1>
	<s1 page="0012-0014" title="ಗಕಾರಗಣಪತಿಸಹಸ್ರನಾಮಾವಳಿಯ ಉಪೋದ್ಘಾತ" author=""></s1>
	<s1 page="0015-0044" title="ಗಕಾರಗಣಪತಿ ಸಹಸ್ರನಾಮಾವಳಿ" author=""></s1>
	<s1 page="0045-0047" title="ಶ್ರೀದಕ್ಷಿಣಾಮೂರ್ತ್ಯಷ್ಟೋತ್ತರಶತನಾಮಾವಳಿಯ ಉಪೋದ್ಘಾತ" author=""></s1>
	<s1 page="0048-0051" title="ಶ್ರೀದಕ್ಷಿಣಾಮೂರ್ತ್ಯಷ್ಟೋತ್ತರಶತನಾಮಾವಳಿ" author=""></s1>
	<s1 page="0052-0058" title="ಶ್ರೀಲಲಿತಾಸಹಸ್ರನಾಮಾವಳಿಯ ಉಪೋದ್ಘಾತ" author=""></s1>
	<s1 page="0059-0064" title="ಶ್ರೀಲಲಿತಾಸಹಸ್ರನಾಮಪೂರ್ವಪೀಠಿಕೆಯ ಅರ್ಥಾನುವಾದ" author=""></s1>
	<s1 page="0065-0071" title="ಶ್ರೀಲಲಿತಾಸಹಸ್ರನಾಮಪೂರ್ವಪೀಠಿಕೆ" author=""></s1>
	<s1 page="0072-0090" title="ಶ್ರೀಲಲಿತಾಸಹಸ್ರನಾಮಸ್ತೋತ್ರ" author=""></s1>
	<s1 page="0091-0100" title="ಶ್ರೀಲಲಿತಾಸಹಸ್ರನಾಮೋತ್ತರಪೀಠಿಕೆ" author=""></s1>
	<s1 page="0101-0137" title="ಶ್ರೀಲಲಿತಾಸಹಸ್ರನಾಮಾವಳಿ" author=""></s1>
	<s1 page="0138-0141" title="ಶ್ರೀಲಲಿತಾಸಹಸ್ರನಾಮ ವಿಶೇಷವಿಷಯಸಂಗ್ರಹ" author=""></s1>
	<s1 page="0142-0145" title="ಶ್ರೀಲಲಿತಾನಾಮತ್ರಿಶತಿಯ ಉಪೋದ್ಘಾತ" author=""></s1>
	<s1 page="0146-0149" title="ಶ್ರೀಲಲಿತಾನಾಮತ್ರಿಶತೀಪೂರ್ವಪೀಠಿಕೆ" author=""></s1>
	<s1 page="0150-0156" title="ಶ್ರೀಲಲಿತಾನಾಮತ್ರಿಶತೀಸ್ತೋತ್ರ" author=""></s1>
	<s1 page="0156-0160" title="ಶ್ರೀಲಲಿತಾನಾಮತ್ರಿಶತ್ಯುತ್ತರಪೀಠಿಕೆ" author=""></s1>
	<s1 page="0161-0170" title="ಶ್ರೀಲಲಿತಾತ್ರಿಶತೀನಾಮಾವಳಿ" author=""></s1>
	<s1 page="0171-0175" title="ಶ್ರೀಲಲಿತಾಷ್ಟೋತ್ತರಶತನಾಮಾವಳಿಯ ಉಪೋದ್ಘಾತ" author=""></s1>
	<s1 page="0176-0179" title="ಶ್ರೀಲಲಿತಾಷ್ಟೋತ್ತರಶತನಾಮಾವಳಿ" author=""></s1>
	<s1 page="0180-0180" title="ಶ್ರೀಲಲಿತಾಪಂಚವಿಂಶತಿನಾಮಾವಳಿಯ ಉಪೋದ್ಘಾತ" author=""></s1>
	<s1 page="0181-0181" title="ಶ್ರೀಲಲಿತಾಪಂಚವಿಂಶತಿನಾಮಾವಳಿ" author=""></s1>
	<s1 page="0182-0194" title="ಶ್ರೀಶಿವಸಹಸ್ರನಾಮಾವಳಿಯ ಉಪೋದ್ಘಾತ" author=""></s1>
	<s1 page="0195-0225" title="ಶ್ರೀಶಿವಸಹಸ್ರನಾಮಾವಳಿ" author=""></s1>
	<s1 page="0225-0226" title="ಶ್ರೀಶಿವಸಹಸ್ರನಾಮಾವಳಿವಿಶೇಷವಿಚಾರ" author=""></s1>
	<s1 page="0226-0227" title="ಶ್ರೀಶಿವಾಷ್ಟೋತ್ತರಶತನಾಮಾವಳಿಯ ಉಪೋದ್ಘಾತ" author=""></s1>
	<s1 page="0228-0231" title="ಶ್ರೀಶಿವಾಷ್ಟೋತ್ತರಶತನಾಮಾವಳಿ" author=""></s1>
	<s1 page="0231-0231" title="ಶ್ರೀಶಿವದ್ವಾದಶನಾಮಾವಳಿ (ಉಪೋದ್ಘಾತಸಹಿತ)" author=""></s1>
	<s1 page="0232-0232" title="ಶ್ರೀಶಿವಾಷ್ಟನಾಮಾವಳಿ (ಉಪೋದ್ಘಾತಸಹಿತ)" author=""></s1>
</book>
