<?xml version="1.0" encoding="UTF-8"?>
<!DOCTYPE book SYSTEM "book.dtd">

<book id="064">
	<s1 page="0000b-0000b" title="ಮುನ್ನುಡಿ" author="ನಾಗೇಶ"></s1>
	<s1 page="0001-0009" title="೧ನೇ ಪರಿಚ್ಛೇದ" author=""></s1>
	<s1 page="0009-0017" title="೨ನೇ ಪರಿಚ್ಛೇದ" author=""></s1>
	<s1 page="0017-0025" title="೩ನೇ ಪರಿಚ್ಛೇದ" author=""></s1>
	<s1 page="0025-0034" title="೪ನೇ ಪರಿಚ್ಛೇದ" author=""></s1>
	<s1 page="0034-0040" title="೫ನೇ ಪರಿಚ್ಛೇದ" author=""></s1>
	<s1 page="0040-0049" title="೬ನೇ ಪರಿಚ್ಛೇದ" author=""></s1>
	<s1 page="0050-0057" title="೭ನೇ ಪರಿಚ್ಛೇದ" author=""></s1>
	<s1 page="0057-0068" title="೮ನೇ ಪರಿಚ್ಛೇದ" author=""></s1>
	<s1 page="0068-0077" title="೯ನೇ ಪರಿಚ್ಛೇದ" author=""></s1>
	<s1 page="0077-0083" title="೧೦ನೇ ಪರಿಚ್ಛೇದ" author=""></s1>
	<s1 page="0083-0090" title="೧೧ನೇ ಪರಿಚ್ಛೇದ" author=""></s1>
	<s1 page="0090-0097" title="೧೨ನೇ ಪರಿಚ್ಛೇದ" author=""></s1>
	<s1 page="0097-0103" title="೧೩ನೇ ಪರಿಚ್ಛೇದ" author=""></s1>
	<s1 page="0103-0110" title="೧೪ನೇ ಪರಿಚ್ಛೇದ" author=""></s1>
	<s1 page="0110-0115" title="೧೫ನೇ ಪರಿಚ್ಛೇದ" author=""></s1>
	<s1 page="0115-0122" title="೧೬ನೇ ಪರಿಚ್ಛೇದ" author=""></s1>
	<s1 page="0122-0126" title="೧೭ನೇ ಪರಿಚ್ಛೇದ" author=""></s1>
	<s1 page="0126-0132" title="೧೮ನೇ ಪರಿಚ್ಛೇದ" author=""></s1>
	<s1 page="0133-0141" title="೧೯ನೇ ಪರಿಚ್ಛೇದ" author=""></s1>
	<s1 page="0141-0148" title="೨೦ನೇ ಪರಿಚ್ಛೇದ" author=""></s1>
	<s1 page="0148-0153" title="೨೧ನೇ ಪರಿಚ್ಛೇದ" author=""></s1>
	<s1 page="0153-0159" title="೨೨ನೇ ಪರಿಚ್ಛೇದ" author=""></s1>
	<s1 page="0159-0165" title="೨೩ನೇ ಪರಿಚ್ಛೇದ" author=""></s1>
	<s1 page="0166-0170" title="೨೪ನೇ ಪರಿಚ್ಛೇದ" author=""></s1>
</book>
