<?xml version="1.0" encoding="UTF-8"?>
<!DOCTYPE book SYSTEM "book.dtd">
<book id="011" sstitle="ಫ. ಗು. ಹಳಕಟ್ಟಿ">
	<s1 page="0001-0014" title="೧. ಲಿಂಗಪೂಜೆಯ ತತ್ವಗಳು -೧೯೨೬" author=""></s1>
	<s1 page="0015-0026" title="೨. ಲಿಂಗಪೂಜೆಯ ತತ್ವಗಳು -೧೯೩೫" author=""></s1>
	<s1 page="0027-0060" title="೩. ಭಕ್ತಿಯ ವಚನಗಳು" author=""></s1>
	<s1 page="0061-0116" title="೪. ನೈತಿಕ ಮತ್ತು ಭಕ್ತಿಯ ವಚನಗಳು" author=""></s1>
	<s1 page="0117-0150" title="೫. ಪರಮಾತ್ಮನ ಸ್ವರೂಪ" author=""></s1>
	<s1 page="0151-0200" title="೬ ಲಿಂಗ ಮತ್ತು ಪರಮಾತ್ಮ" author=""></s1>
	<s1 page="0201-0286" title="೭. ಶಿವಾನುಭವ ಸತ್ಯಮಾರ್ಗ" author=""></s1>
	<s1 page="0287-0358" title="೮. ಬಸವೇಶ್ವರನ ತತ್ವಗಳು" author=""></s1>
	<s1 page="0359-0386" title="೯. ಶಿವಶರಣರ ಅಹಿಂಸಾಧರ್ಮ" author=""></s1>
	<s1 page="0387-0414" title="೧೦. ಸಂಗೀತದಲ್ಲಿ ಶಿವಶರಣರ ವಚನಗಳು" author=""></s1>
	<s1 page="0415-0500" title="೧೧. Vachnas of Shri Basaveshwara" author=""></s1>
</book>
