<?xml version="1.0" encoding="UTF-8"?>
<!DOCTYPE book SYSTEM "book.dtd">

<book id="068">
	<s1 page="0000c-0000d" title="Preface" author="M. S. P."></s1>
	<s1 page="0000f-0000g" title="ಪೀಠಿಕೆ" author="ಮೈ. ಸೂ. ಪು."></s1>
	<s1 page="0001-0033" title="೧. ಅಂಕ " author="ಷೇಕ್ಸ್ ಪೀರ್">
		<s2 page="0001-0012" title="೧ನೇ ಪ್ರಕರಣ &#8212; ಧೊರೆಯ ಅರಮನೆ" author=""></s2>
		<s2 page="0012-0018" title="೨ನೇ ಪ್ರಕರಣ &#8212; ದುಃಖಸಾರನ ಗೃಹ" author=""></s2>
		<s2 page="0018-0019" title="೩ನೇ ಪ್ರಕರಣ &#8212; ಭದ್ರನಾಥನ ಅರಮನೆ" author=""></s2>
		<s2 page="0019-0031" title="೪ನೇ ಪ್ರಕರಣ &#8212; ಭದ್ರನಾಥನ ಅರಮನೆ" author=""></s2>
		<s2 page="0031-0033" title="೫ನೇ ಪ್ರಕರಣ &#8212; ಭದ್ರನಾಥನ ಅರಮನೆಯ ಓಲಗಶಾಲೆ" author=""></s2>
	</s1>
	<s1 page="0033-0056" title="೨ನೇ ಅಂಕ" author="ಷೇಕ್ಸ್ ಪೀರ್">
		<s2 page="0033-0038" title="೧ನೇ ಪ್ರಕರಣ &#8212; ದುಃಖಸಾರನ ಮಂದಿರ" author=""></s2>
		<s2 page="0039-0044" title="೨ನೇ ಪ್ರಕರಣ &#8212; ದುಃಖಸಾರನ ಮಂದಿರ ಮುಂಭಾಗ" author=""></s2>
		<s2 page="0045-0045" title="೩ನೇ ಪ್ರಕರಣ &#8212; ಕಾಡು" author=""></s2>
		<s2 page="0045-0056" title="೪ನೇ ಪ್ರಕರಣ &#8212; ದುಃಖಸಾರನ ಮನೆಯ ಮುಂದೆ &#8212; ನಿಷ್ಕಂಟಕ ಕೋಳವನ್ನು ಅನುಭವಿಸುತ್ತಾ ಇರುವನು" author=""></s2>
	</s1>
	<s1 page="0057-0077" title="೩ನೇ ಅಂಕ" author="ಷೇಕ್ಸ್ ಪೀರ್">
		<s2 page="0057-0058" title="೧ನೇ ಪ್ರಕರಣ &#8212; ಬೆಟ್ಟದ ತಪ್ಪಲು" author=""></s2>
		<s2 page="0059-0061" title="೨ನೇ ಪ್ರಕರಣ &#8212; ತೊಪ್ಪಲಿನ ಮತ್ತೊಂದು ಕಡೆ ಬಿರುಗಾಳಿ ಬೀಸುವುದು" author=""></s2>
		<s2 page="0061-0062" title="೩ನೇ ಪ್ರಕರಣ &#8212; ದುಃಖಸಾರ ಕುಮಂತ್ರರ ಪ್ರವೇಶ" author=""></s2>
		<s2 page="0062-0068" title="೪ನೇ ಪ್ರಕರಣ &#8212; ಬೆಟ್ಟದ ತಪ್ಪಲು, ಗುಹೆ ಮುಂದೆ" author=""></s2>
		<s2 page="0068-0069" title="೫ನೇ ಪ್ರಕರಣ &#8212; ದುಃಖಸಾರನ ಭವನ" author=""></s2>
		<s2 page="0069-0073" title="೬ನೇ ಪ್ರಕರಣ &#8212; ದುಃಖಸಾರನ ಭವನದ ಸಮೀಪದಲ್ಲಿರುವ ತುಡುಕೇ ಮನೆ" author=""></s2>
		<s2 page="0073-0077" title="೭ನೇ ಪ್ರಕರಣ ದುಃಖಸಾರನ ಮಂದಿರ" author=""></s2>
	</s1>
	<s1 page="0078-0104" title="೪ನೇ ಅಂಕ" author="ಷೇಕ್ಸ್ ಪೀರ್">
		<s2 page="0078-0081" title="೧ನೇ ಪ್ರಕರಣ &#8212; ತಪ್ಪಲು" author=""></s2>
		<s2 page="0081-0085" title="೨ನೇ ಪ್ರಕರಣ &#8212; ಭದ್ರನಾಥನ ಅರಮನೆಯ ಮುಂದೆ" author=""></s2>
		<s2 page="0085-0087" title="೩ನೇ ಪ್ರಕರಣ &#8212; ದೇವರೇವಿನ ಹತ್ತರ ಮಾರದೇಶದ ಸೇನೆಯ ಪಾಳಯ" author=""></s2>
		<s2 page="0087-0088" title="೪ನೇ ಪ್ರಕರಣ &#8212; ದೇವರೇವಿನ ಹತ್ತರದ ಪಾಳಯ &#8212; ಒಂದು ಗೂಡಾರದಲ್ಲಿ" author=""></s2>
		<s2 page="0088-0090" title="೫ನೇ ಪ್ರಕರಣ &#8212; ಪ್ರವೇಶ &#8212; ವಿಷಜೆ, ರಾಹುಕ" author=""></s2>
		<s2 page="0090-0100" title="೬ನೇ ಪ್ರಕರಣ &#8212; ದೇವರೇವಿನ ಸಮೀಪದ ಹೊಲಗಳು" author=""></s2>
		<s2 page="0100-0104" title="೭ನೇ ಪ್ರಕರಣ &#8212; ಮಾರದೇಶದ ಪಾಳಯದಲ್ಲಿ ಒಂದು ಗೂಡಾರ. ಧೊರೆ ನಿದ್ರೆಮಾಡುತಾ ಹಾಸುಗೇಮೇಲೆ ಮಲಗಿಕೊಂಡಿರುವನು. ಇಂಪಾದ ಗಾನವಾಗುತಿರುವುದು. ದೊಡ್ಡಮನುಷ್ಯ ಮತ್ತು ಇತರರು ಅಂಗರಕ್ಷಕರಾಗಿರುವರು" author=""></s2>
	</s1>
	<s1 page="0104-0120" title="೫ನೇ ಅಂಕ" author="ಷೇಕ್ಸ್ ಪೀರ್">
		<s2 page="0104-0107" title="೧ನೇ ಪ್ರಕರಣ &#8212; ದೇವರೇವಿನ ಸಮೀಪದಲ್ಲಿ ನೀಲಪುರೀಸೇನೆಯ ಪಾಳಯ" author=""></s2>
		<s2 page="0107-0107" title="೨ನೇ ಪ್ರಕರಣ &#8212; ಎರಡು ಪಾಳಯಕ್ಕೂ ಮಧ್ಯೆ ಮೈದಾನ ಒಳಗೆ ಕೋಲಾಹಲ" author=""></s2>
		<s2 page="0108-0120" title="೩ನೇ ಪ್ರಕರಣ &#8212; ದೇವರೇವಿನ ಸಮೀಪದಲ್ಲಿ ನೀಲಪುರೀ ಸೇನೆಯ ಪಾಳಯ" author=""></s2>
	</s1>
</book>
