<?xml version="1.0" encoding="UTF-8"?>
<!DOCTYPE book SYSTEM "book.dtd">

<book id="056">
	<s1 page="" title="ಕವನ" author="">
		<s2 page="0001-0001" title="ಕನ್ನಡಿಗನ ಕೊರಗು" author="ತೀ. ನಂ. ಶ್ರೀಕಂಠಯ್ಯ"></s2>
		<s2 page="0002-0003" title="ಪೊದೆಯ ಹಕ್ಕಿ, ಎದೆಯ ಹಕ್ಕಿ" author="ಕೆ. ವಿ. ಪುಟ್ಟಪ್ಪ"></s2>
		<s2 page="0004-0006" title="ಪ್ರತಿಭೆ" author="ತೀ. ನಂ. ಶ್ರೀಕಂಠಯ್ಯ"></s2>
		<s2 page="0007-0008" title="ಕೇಳಿಕೆ" author="ವಿ. ಕೆ. ಪುಟ್ಟರಾಮು"></s2>
		<s2 page="0009-0010" title="ಕವಿತೆಗೆ" author="ತೀ. ನಂ. ಶ್ರೀಕಂಠಯ್ಯ"></s2>
		<s2 page="0011-0014" title="ಹೀರೆಯ ಹೂವು" author="ಕೆ. ವಿ. ಪುಟ್ಟಪ್ಪ"></s2>
		<s2 page="0015-0018" title="ಪಾರಿಜಾತ" author="ತೀ. ನಂ. ಶ್ರೀಕಂಠಯ್ಯ"></s2>
		<s2 page="0019-0021" title="ಹಕ್ಕಿಗೆ" author="ವಿ. ಕೆ. ಪುಟ್ಟರಾಮು"></s2>
		<s2 page="0022-0022" title="ಅರ್ಧಚಂದ್ರ" author="ಕೆ. ವಿ. ಪುಟ್ಟಪ್ಪ"></s2>
		<s2 page="0023-0023" title="ಗುರು" author="ಕೆ. ವಿ. ಪುಟ್ಟಪ್ಪ"></s2>
		<s2 page="0024-0028" title="ಚಟಾಕಿ" author="ಎಲ್. ಗುಂಡಪ್ಪ"></s2>
		<s2 page="0029-0049" title="ಬೊಮ್ಮನಹಳ್ಳಿಯ ಕಿಂದರಿಜೋಗಿ" author="ಕೆ. ವಿ. ಪುಟ್ಟಪ್ಪ"></s2>
		<s2 page="0050-0053" title="ತಾಯಿ" author="ಎಲ್. ಗುಂಡಪ್ಪ"></s2>
		<s2 page="0054-0054" title="ದೇಶಭಕ್ತಿ" author="ತೀ. ನಂ. ಶ್ರೀಕಂಠಯ್ಯ"></s2>
		<s2 page="0055-0055" title="ದೋರಸಮುದ್ರ" author="ಎಲ್. ಗುಂಡಪ್ಪ"></s2>
		<s2 page="0056-0059" title="ಹೋದ ಬಾಳ ಬೆಳಕು" author="ಕೆ. ವಿ. ಪುಟ್ಟಪ್ಪ"></s2>
		<s2 page="0060-0063" title="ಚಿತ್ತ ಕ್ಷೋಭೆ" author="ವಿ. ಕೆ. ಪುಟ್ಟರಾಮು"></s2>
		<s2 page="0064-0067" title="ದೂರು" author="ಎಲ್. ಗುಂಡಪ್ಪ"></s2>
		<s2 page="0068-0072" title="ನನ್ನ ನಾಯಿ" author="ಪಿ. ಟಿ. ನರಸಿಂಹಾಚಾರ್"></s2>
		<s2 page="0073-0073" title="ಜಿಂಕೆ" author="ವಿ. ಕೆ. ಪುಟ್ಟರಾಮು"></s2>
		<s2 page="0074-0074" title="ವಿಧವೆ" author="ಎಲ್. ಗುಂಡಪ್ಪ"></s2>
		<s2 page="0075-0078" title="ಅಕ್ಕ" author="ಎಲ್. ಗುಂಡಪ್ಪ"></s2>
		<s2 page="0079-0080" title="ಬಯಕೆ" author="ತೀ. ನಂ. ಶ್ರೀಕಂಠಯ್ಯ"></s2>
		<s2 page="0081-0084" title="ತೊರೆ" author="ಪಿ. ಟಿ. ನರಸಿಂಹಾಚಾರ್"></s2>
		<s2 page="0085-0086" title="ಮಲೆನಾಡ ಹುಡುಗಿ" author="ಎಲ್. ಗುಂಡಪ್ಪ"></s2>
		<s2 page="0087-0088" title="ಎರಡು ದಾರಿ" author="ತೀ. ನಂ. ಶ್ರೀಕಂಠಯ್ಯ"></s2>
		<s2 page="0089-0089" title="ಬಿಡುಗಡೆ" author="ಡಿ. ಎಲ್. ನರಸಿಂಹಾಚಾರ್"></s2>
		<s2 page="0090-0090" title="ದೇವನ ಹರಿಕಾರರು (೧)" author="ತೀ. ನಂ. ಶ್ರೀಕಂಠಯ್ಯ"></s2>
		<s2 page="0091-0092" title="ದೇವನ ಹರಿಕಾರರು (೨)" author="ಎಲ್. ಗುಂಡಪ್ಪ"></s2>
		<s2 page="0093-0094" title="ಜೀವನ" author="ಡಿ. ಎಲ್. ನರಸಿಂಹಾಚಾರ್"></s2>
		<s2 page="0095-0096" title="ಆತ್ಮನಿವೇದನ" author="ಕೆ. ವಿ. ಪುಟ್ಟಪ್ಪ"></s2>
	</s1>
</book>
