<?xml version="1.0" encoding="UTF-8"?>
<!DOCTYPE book SYSTEM "book.dtd">

<book id="057">
	<s1 page="0000g-0000g" title="Foreword" author=""></s1>
	<s1 page="0000k-0000o" title="ಇಂಗ್ಲಿಷ್ ಮಹಾಕವಿಯಾದ ಆಲಿವರ್ ಗೋಲ್ಡಸ್ಮಿತ್ತಿನ ಸಂಕ್ಷಿಪ್ತ ಜೀವನಚರಿತೆ" author="ಎಸ್. ಜಿ. ಗೋವಿಂದರಾಜ ಅಯ್ಯಂಗಾರ್ಯ"></s1>
	<s1 page="0001-0006" title="ಮೊದಲನೆಯ ಅಧ್ಯಾಯ" author="ಎಸ್. ಜಿ. ಗೋವಿಂದರಾಜ ಅಯ್ಯಂಗಾರ್ಯ"></s1>
	<s1 page="0006-0010" title="ಎರಡನೆಯ ಅಧ್ಯಾಯ" author="ಎಸ್. ಜಿ. ಗೋವಿಂದರಾಜ ಅಯ್ಯಂಗಾರ್ಯ"></s1>
	<s1 page="0011-0019" title="ಮೂರನೆಯ ಅಧ್ಯಾಯ" author="ಎಸ್. ಜಿ. ಗೋವಿಂದರಾಜ ಅಯ್ಯಂಗಾರ್ಯ"></s1>
	<s1 page="0019-0023" title="ನಾಲ್ಕನೆಯ ಅಧ್ಯಾಯ" author="ಎಸ್. ಜಿ. ಗೋವಿಂದರಾಜ ಅಯ್ಯಂಗಾರ್ಯ"></s1>
	<s1 page="0023-0028" title="ಐದನೆಯ ಅಧ್ಯಾಯ" author="ಎಸ್. ಜಿ. ಗೋವಿಂದರಾಜ ಅಯ್ಯಂಗಾರ್ಯ"></s1>
	<s1 page="0028-0032" title="ಆರನೆಯ ಅಧ್ಯಾಯ" author="ಎಸ್. ಜಿ. ಗೋವಿಂದರಾಜ ಅಯ್ಯಂಗಾರ್ಯ"></s1>
	<s1 page="0033-0037" title="ಏಳನೆಯ ಅಧ್ಯಾಯ" author="ಎಸ್. ಜಿ. ಗೋವಿಂದರಾಜ ಅಯ್ಯಂಗಾರ್ಯ"></s1>
	<s1 page="0038-0047" title="ಎಂಟನೆಯ ಅಧ್ಯಾಯ" author="ಎಸ್. ಜಿ. ಗೋವಿಂದರಾಜ ಅಯ್ಯಂಗಾರ್ಯ"></s1>
	<s1 page="0048-0051" title="ಒಂಬತ್ತನೆಯ ಅಧ್ಯಾಯ" author="ಎಸ್. ಜಿ. ಗೋವಿಂದರಾಜ ಅಯ್ಯಂಗಾರ್ಯ"></s1>
	<s1 page="0052-0056" title="ಹತ್ತನೆಯ ಅಧ್ಯಾಯ" author="ಎಸ್. ಜಿ. ಗೋವಿಂದರಾಜ ಅಯ್ಯಂಗಾರ್ಯ"></s1>
	<s1 page="0057-0062" title="ಹನ್ನೊಂದನೆಯ ಅಧ್ಯಾಯ" author="ಎಸ್. ಜಿ. ಗೋವಿಂದರಾಜ ಅಯ್ಯಂಗಾರ್ಯ"></s1>
	<s1 page="0062-0068" title="ಹನ್ನೆರಡನೆಯ ಅಧ್ಯಾಯ" author="ಎಸ್. ಜಿ. ಗೋವಿಂದರಾಜ ಅಯ್ಯಂಗಾರ್ಯ"></s1>
	<s1 page="0069-0073" title="ಹದಿಮೂರನೆಯ ಅಧ್ಯಾಯ" author="ಎಸ್. ಜಿ. ಗೋವಿಂದರಾಜ ಅಯ್ಯಂಗಾರ್ಯ"></s1>
	<s1 page="0073-0079" title="ಹದಿನಾಲ್ಕನೆಯ ಅಧ್ಯಾಯ" author="ಎಸ್. ಜಿ. ಗೋವಿಂದರಾಜ ಅಯ್ಯಂಗಾರ್ಯ"></s1>
	<s1 page="0080-0085" title="ಹದಿನಯ್ದನೆಯ ಅಧ್ಯಾಯ" author="ಎಸ್. ಜಿ. ಗೋವಿಂದರಾಜ ಅಯ್ಯಂಗಾರ್ಯ"></s1>
	<s1 page="0085-0091" title="ಹದಿನಾರನೆಯ ಅಧ್ಯಾಯ" author="ಎಸ್. ಜಿ. ಗೋವಿಂದರಾಜ ಅಯ್ಯಂಗಾರ್ಯ"></s1>
	<s1 page="0091-0100" title="ಹದಿನೇಳನೆಯ ಅಧ್ಯಾಯ" author="ಎಸ್. ಜಿ. ಗೋವಿಂದರಾಜ ಅಯ್ಯಂಗಾರ್ಯ"></s1>
	<s1 page="0100-0104" title="ಹದಿನೆಂಟನೆಯ ಅಧ್ಯಾಯ" author="ಎಸ್. ಜಿ. ಗೋವಿಂದರಾಜ ಅಯ್ಯಂಗಾರ್ಯ"></s1>
	<s1 page="0104-0108" title="ಹತ್ತೊಂಬತ್ತನೆಯ ಅಧ್ಯಾಯ" author="ಎಸ್. ಜಿ. ಗೋವಿಂದರಾಜ ಅಯ್ಯಂಗಾರ್ಯ"></s1>
	<s1 page="0108-0123" title="ಇಪ್ಪತ್ತನೆಯ ಅಧ್ಯಾಯ" author="ಎಸ್. ಜಿ. ಗೋವಿಂದರಾಜ ಅಯ್ಯಂಗಾರ್ಯ"></s1>
	<s1 page="0123-0132" title="ಇಪ್ಪತ್ತೊಂದನೆಯ ಅಧ್ಯಾಯ" author="ಎಸ್. ಜಿ. ಗೋವಿಂದರಾಜ ಅಯ್ಯಂಗಾರ್ಯ"></s1>
	<s1 page="0132-0136" title="ಇಪ್ಪತ್ತೆರಡನೆಯ ಅಧ್ಯಾಯ" author="ಎಸ್. ಜಿ. ಗೋವಿಂದರಾಜ ಅಯ್ಯಂಗಾರ್ಯ"></s1>
	<s1 page="0136-0140" title="ಇಪ್ಪತ್ತಮೂರನೆಯ ಅಧ್ಯಾಯ" author="ಎಸ್. ಜಿ. ಗೋವಿಂದರಾಜ ಅಯ್ಯಂಗಾರ್ಯ"></s1>
	<s1 page="0140-0145" title="ಇಪ್ಪತ್ತನಾಲ್ಕನೆಯ ಅಧ್ಯಾಯ" author="ಎಸ್. ಜಿ. ಗೋವಿಂದರಾಜ ಅಯ್ಯಂಗಾರ್ಯ"></s1>
	<s1 page="0145-0150" title="ಇಪ್ಪತ್ತಯ್ದನೆಯ ಅಧ್ಯಾಯ" author="ಎಸ್. ಜಿ. ಗೋವಿಂದರಾಜ ಅಯ್ಯಂಗಾರ್ಯ"></s1>
	<s1 page="0150-0155" title="ಇಪ್ಪತ್ತಾರನೆಯ ಅಧ್ಯಾಯ" author="ಎಸ್. ಜಿ. ಗೋವಿಂದರಾಜ ಅಯ್ಯಂಗಾರ್ಯ"></s1>
	<s1 page="0156-0159" title="ಇಪ್ಪತ್ತ ಏಳನೆಯ ಅಧ್ಯಾಯ" author="ಎಸ್. ಜಿ. ಗೋವಿಂದರಾಜ ಅಯ್ಯಂಗಾರ್ಯ"></s1>
	<s1 page="0159-0169" title="ಇಪ್ಪತ್ತ ಎಂಟನೆಯ ಅಧ್ಯಾಯ" author="ಎಸ್. ಜಿ. ಗೋವಿಂದರಾಜ ಅಯ್ಯಂಗಾರ್ಯ"></s1>
	<s1 page="0169-0174" title="ಇಪ್ಪತ್ತ ಒಂಬತ್ತನೆಯ ಅಧ್ಯಾಯ" author="ಎಸ್. ಜಿ. ಗೋವಿಂದರಾಜ ಅಯ್ಯಂಗಾರ್ಯ"></s1>
	<s1 page="0174-0182" title="ಮೂವತ್ತನೆಯ ಅಧ್ಯಾಯ" author="ಎಸ್. ಜಿ. ಗೋವಿಂದರಾಜ ಅಯ್ಯಂಗಾರ್ಯ"></s1>
	<s1 page="0182-0197" title="ಮೂವತ್ತ ಒಂದನೆಯ ಅಧ್ಯಾಯ" author="ಎಸ್. ಜಿ. ಗೋವಿಂದರಾಜ ಅಯ್ಯಂಗಾರ್ಯ"></s1>
	<s1 page="0197-0200" title="ಮೂವತ್ತೆರಡನೆಯ ಅಧ್ಯಾಯ" author="ಎಸ್. ಜಿ. ಗೋವಿಂದರಾಜ ಅಯ್ಯಂಗಾರ್ಯ"></s1>
</book>
