<?xml version="1.0" encoding="UTF-8"?>
<!DOCTYPE book SYSTEM "book.dtd">

<book id="001">
	<s1 page="0000g-0000g" title="ಮುನ್ನುಡಿ" author="ಕೆಂಪೇಗೌಡ ಕೆ."></s1>
	<s1 page="0000h-0000h" title="ವಿಭಾಗ ಸಂಪಾದಕರ ಮಾತು" author="ಡಾ. ಸತ್ಯನಾರಾಯಣ"></s1>
	<s1 page="0000i-0000k" title="ಮೊದಲಮಾತು" author="ವಿಲಿಯಮ್ ಜೆ. ಗೂಡ್;ಪಾಲ್ ಕೆ. ಹ್ಯಾಟ್"></s1>
	<s1 page="0000l-0000l" title="ಅನುವಾದಕರ ಅರಿಕೆ" author="ಶಿವಮೂರ್ತಿ ಎಂ."></s1>
	<s1 page="0001-0008" title="೧. ನೂತನ ಸಮಾಜಶಾಸ್ತ್ರ" author=""></s1>
	<s1 page="0009-0025" title="೨. ಸಿದ್ದಾಂತ ಮತ್ತು ವಾಸ್ತವಾಂಶ" author=""></s1>
	<s1 page="0026-0042" title="೩. ಮೌಲ್ಯಗಳು ಮತ್ತು ವಿಜ್ಞಾನ" author=""></s1>
	<s1 page="0042-0059" title="೪. ಶುದ್ಧ ಮತ್ತು ಆನ್ವಯಿಕ ವಿಜ್ಞಾನ" author=""></s1>
	<s1 page="0060-0082" title="೫. ವೈಜ್ಞಾನಿಕ ವಿಧಾನದ ಮೂಲತತ್ತ್ವಗಳು ಮೂಲ ಕಲ್ಪನೆಗಳು" author=""></s1>
	<s1 page="0083-0111" title="೬. ವೈಜ್ಞಾನಿಕ ವಿಧಾನದ ಮೂಲ ಅಂಶಗಳು : ಆಧಾರಕಲ್ಪನೆಗಳು" author=""></s1>
	<s1 page="0112-0136" title="೭. ಸಾಧನೆಯ ವಿನ್ಯಾಸ : ಆಧಾರಕಲ್ಪನೆಯ ಪರಿವೀಕ್ಷಣೆ" author=""></s1>
	<s1 page="0137-0151" title="೮. ಸಂಶೋಧನ ವಿನ್ಯಾಸದಲ್ಲಿ ಮತ್ತಷ್ಟು ಸಮಸ್ಯೆಗಳು" author=""></s1>
	<s1 page="0152-0176" title="೯. ಗ್ರಂಥಾಲಯದ ಬಳಕೆ" author=""></s1>
	<s1 page="0177-0194" title="೧೦. ವೀಕ್ಷಣೆ" author=""></s1>
	<s1 page="0195-0257" title="೧೧. ಪ್ರಶ್ನಾವಳಿಯ ರಚನೆ" author=""></s1>
	<s1 page="0258-0277" title="೧೨. ಅಂಚೆ ಪ್ರಶ್ನಾವಳಿ" author=""></s1>
	<s1 page="0278-0317" title="೧೩. ಸಂದರ್ಶನ" author=""></s1>
	<s1 page="0318-0352" title="೧೪. ಸಂಭವಶಾಸ್ತ್ರ ಮತ್ತು ನಿದರ್ಶನಶಾಸ್ತ್ರ" author=""></s1>
	<s1 page="0353-0368" title="೧೫. ಸ್ಕೇಲಿಂಗ್ ತಂತ್ರಗಳು : ಮೂಲ ಸಮಸ್ಯೆ" author=""></s1>
	<s1 page="0369-0392" title="೧೬. ಸ್ಕೇಲಿಂಗ್ ತಂತ್ರಗಳು : ಸಾಮಾಜಿಕ ಅಂತರದ, ಸಾಮಾಜಿಕ ಮಾಪನಶಾಸ್ತ್ರದ ಹಾಗೂ ತುಲನಾತ್ಮಕ ಸ್ಕೇಲುಗಳು" author=""></s1>
	<s1 page="0393-0453" title="೧೭. ಸ್ಕೇಲಿಂಗ್ ತಂತ್ರಗಳು : ಅನುಕ್ರಮಕರಣದ, ಆಂತಃ ಸುಸಂಬದ್ಧತೆಯ ಹಾಗೂ ಸ್ಕೇಲೋಗ್ರ್ಯಾಮ್ ಸ್ಕೇಲುಗಳು" author=""></s1>
	<s1 page="0454-0480" title="೧೮. ಜನಸಂಖ್ಯಾ ಸಂಶೋಧನೆ" author=""></s1>
	<s1 page="0481-0525" title="೧೯. ಗುಣಾತ್ಮಕ ಮತ್ತು ವಿಶ್ಲೇಷಣೆಯಲ್ಲಿನ ಕೆಲವು ಸಮಸ್ಯೆಗಳು" author=""></s1>
	<s1 page="0526-0551" title="೨೦. ದತ್ತಾಂಶಗಳ ವಿಶ್ಲೇಷಣೆ" author=""></s1>
	<s1 page="0552-0580" title="೨೧. ವರದಿ ತಯಾರಿಕೆ" author=""></s1>
	<s1 page="0581-0592" title="ಪಾರಿಭಾಷಿಕ ಪದಕೋಶ" author=""></s1>
	<s1 page="0593-0599" title="ವಿಷಯಸೂಚಿ" author=""></s1>
</book>
